{
  "agent": "wb-integration-tester",
  "status": "PASS",
  "hard_gate": true,
  "summary": "Golden path acceptance criteria are covered.",
  "issues": [],
  "test_execution": {
    "total": 4,
    "passed": 4,
    "failed": 0,
    "errored": 0,
    "duration_ms": 500
  },
  "coverage_map": [
    {
      "criterion": "State reaches summary complete",
      "test_file": "docs/golden-path-demo/.wannabuild/state.json",
      "test_name": "summary state fixture",
      "status": "covered"
    },
    {
      "criterion": "Review verdicts pass",
      "test_file": "docs/golden-path-demo/.wannabuild/review",
      "test_name": "passing review fixtures",
      "status": "covered"
    },
    {
      "criterion": "QA summary exists",
      "test_file": "docs/golden-path-demo/.wannabuild/outputs/qa-summary.md",
      "test_name": "qa summary fixture",
      "status": "covered"
    },
    {
      "criterion": "Integration tester evidence covers the acceptance criteria",
      "test_file": "docs/golden-path-demo/.wannabuild/review/wb-integration-tester-iter-1.json",
      "test_name": "integration evidence fixture",
      "status": "covered"
    }
  ]
}
